header,subheader,author,publish_date,category,text
Ancient painting revealed in Egypt beneath layers of bird poop,A careful cleansing of the ancient temple's walls revealed artwork that has been hidden for thousands of years,,"October 2, 2024 12:02pm EDT",,"Researchers announced Thursday that they have found a hidden 30-foot chamber inside a Great Pyramid in Giza, Egypt. (Reuters) The restoration of the Temple of Edfu has revealed ancient Egyptian paintings dating back thousands of years. The Temple of Edfu is dedicated to the worship of the god Horus, according to the Ministry of Tourism and Antiquities. The temple on the western bank of the Nile was begun during the reign of Ptolemy III and finished under Ptolemy XII, according to the source. It was constructed between 237 and 57 B.C. In far more recent years, restoration efforts have been underway at the temple, conducted in a collaboration between Egypt's Ministry of Tourism and Antiquities and Germany's University of Würzburg. Through careful cleaning of an ancient temple's walls, the remains of bright, colorful paintings were uncovered in Egypt.  (Martin Stadler / Universität Würzburg) IRISH FARMER FINDS NEAR 60-POUND SLAB OF ANCIENT BOG BUTTER ON HIS LAND BY ‘PURE LUCK’ Egyptian temples have long been known to have once been glistening with gold and vivid colors. During the restoration of the Temple of Edfu, remains of ancient artwork have been discovered. Reliefs (a type of sculpting in Ancient Egypt) and paintings were cleaned up by a team of conservators under the leadership of Ahmed Abdel Naby, according to the September 2024 press release. Dust, bird droppings and soot were carefully removed from sandstone reliefs, where remains of ancient artwork began to peer through. Restoration of the Temple of Edfu has been conducted since 2016, according to a press release from the University of Würzburg. (Victoria Altmann-Wendling/Universität Würzburg) MOM, SON DIG UP ANCIENT OBJECT OFTEN FOUND NEAR BURIAL GROUNDS WHILE GARDENING The discovery of these remains is a rare find, as in the majority of ancient Egyptian temples, painting is preserved very minimally or not at all, according to the press release from the University of Würzburg. Gold leaf decorations were also found in the temple, another rare find in Egyptian temples, ""due to their fragility,"" according to the press release. At the Temple of Edfu, most of the gold decorations were discovered in the higher walls of the temple. ""The gilding of the figures presumably not only served to symbolically immortalize and deify them but also contributed to the mystical aura of the room,"" Victoria Altmann-Wendling, the project manager, said in the release. ""It must have been very impressive, especially when the sunlight was shining in."" Rare traces of gold were discovered in paintings within the ancient temple. (Victoria Altmann-Wendling/Universität Würzburg) CLICK HERE TO GET THE FOX NEWS APP ""The fact that the gods were completely gilded is particularly interesting. We find this in the textual sources that describe the flesh of the gods as consisting of gold,"" Altmann-Wendling said, per the press release. In addition, there was also dipinti found at the temple, which is graffiti painted in ink, according to the press release. It was written in Demotic script, and serves as ""direct testimony of the priest entering the temple."" Ashlyn Messier is a writer for Fox News Digital."
Creative couples costumes to take your Halloween up a notch,Check out the pairs from the hottest trends this fall,,"October 1, 2024 11:34am EDT",,"Popular among young people and teenagers, the trendy entertainment is to dress in white bedspreads or sheets symbolically depicting ghosts. Ghost Challenge (iStock) Halloween is around the corner, and contrary to popular belief, the spookiest day of the year isn’t just about ghoulish fun and dressing up in costumes for the kiddos. With Halloween falling on a Thursday this year, you can bet that plenty of adults will play hooky from work the next day to get decked out and throw a Halloween bash to remember. So when that invitation comes in, will you be ready? Don’t get stuck scrambling for that perfectly creative couple’s costume at the last minute. You’ll be the best-dressed pair at the party, from pickleball and paddle sets to movie icons and pop-culture-inspired duos. Here are creative couple costume ideas that are sure to impress! Come as the latest sport trend.  (Spirit Halloween) Pickleball is the fastest-growing sport in America, with more than 36 million people partaking at least once a year. With pickleball rising in the trends, it’s no surprise this pickleball and racket set from Spirit Halloween is one of the hottest couples costumes of the year. It’s also an easy one to just throw on over your clothes and go. For added effect, throw on a pickleball uniform from Spirit Halloween. 5 FUN HALLOWEEN PRODUCTS FOR A KID-FRIENDLY PARTY There are many options to transform into Barbie and Ken. (Spirit Halloween) Nobody puts Barbie in a box! Get inspired by a bit of childhood nostalgia by dressing up as everyone’s favorite doll couple. The Barbie movie may have been released last year but the Barbie and Ken couples costume from Spirit Halloween is still very much of the moment. You can put Ken in a box or on in-line skates like the movie character, if you dare! Check out one of the hottest couples costumes this fall. (Spirit Halloween) Ghostbusters: Frozen Empire grossed $113 million this year at the box office and sparked one of the hottest couples’ costumes of the year. All it entails is this jumpsuit and a proton pack from Halloween Costumes (to fight the ghosts, of course!) And if you want to get extra creative, dress one of your kiddos up as a DIY ghost or everyone’s favorite ghoul, Slimer. Dress up as your favorite political candidate, or make it a pair and come ready to debate.  (Halloweencostumes.com) Considering the hottest current topic is the 2024 presidential election, plenty of folks will dress up like their favorite candidate. But if you prefer to stay bi-partisan, go as a pair dressed as Donald Trump and Kamala Harris. A mask from Halloween Costumes and a business suit are all you need for each and for a little extra oomph, carry a yard sign that supports the dueling nominees. If you’re an Amazon Prime member, you can get these items to your door ASAP. You can join or start a 30-day free trial to start your shopping today. Dress up as your favorite first-world problem. (Walmart) Do you feel like you’re always looking for a place to plug in your phone and recharge? Get on board with this fun take on today’s first-world problems and never run out of power with this plug-and-socket costume from Walmart. Or, staying with the tech theme, if you’re that inseparable pair, go as a pair of earbuds. These have both costumes in one bag for an affordable yet creative look. 5 FUN HALLOWEEN TRUNK-OR-TREAT DECORATION KITS Can you dress up as a phrase? (Walmart) This deer and headlights costume from Walmart is hilarious and relatable, especially if you live in a rural area. A fun take on the phrase ""like a deer in headlights,"" you’ll be the life of the party – especially when they see that the ‘headlights’ actually light up. Solve one of societies greatest debates with this year's costume. (Walmart) Are you and your spouse always arguing about whether the toilet paper should go over or under or whose job it is to replace it when it’s empty? Have a little fun with this empty toilet paper roll costume from Walmart paired with a giant toilet paper roll that makes the statement that its proper position is indeed over. Your fried chicken bucket can also double as a trick-or-treat bucket. (Amazon) While you may be arguing about which one’s the Colonel and which one’s the chicken, there’s no doubt this creative couple’s costume from Amazon will be a huge hit. Don’t forget the bucket – you can DIY by purchasing a plain white bucket, sticking on a KFC sticker and filling it with some fake fried chicken. Be sure to replace it with candy before the end of the night! 11 ESSENTIAL ITEMS TO FILL YOUR HALLOWEEN BOO BASKET Come dressed as your favorite snack.  (Spirit Halloween) Is Avocado toast just for foodies? Not anymore! Everyone loves this easy and healthy breakfast combo, which also makes a fun couples costume from Spirit Halloween and an alternative to the old standby PB&J. The 3D costume is easy to slip into over jeans and requires minimal effort but makes a big impact. For more deals, visit www.foxnews.com/category/deals Consider this popular Beetlejuice pair. (Spirit Halloween) Beetlejuice and Lydia have been a popular couples costume choice for twenty years. But now, with the recently released sequel Beetlejuice Beetlejuice, everyone’s wanting in on the underworld. Although the ghostly characters Barbara and Adam didn’t appear in this installation, they are a good choice that hasn’t been ‘overdone.’ All you need for Adam is this affordable mask from Spirit Halloween with a flannel shirt and a mask for Barbara, with a simple floral dress. Don’t forget to tote along the all-important Handbook for the Recently Deceased. Jené Luciani Sena is a contributing lifestyle reporter for Fox News Digital."
"Archaeologists discover 5,000-year-old ancient community in Morocco",Radiocarbon dating of seeds and charcoal excavated at the site dated the community back to 3400 to 2900 B.C.,,"October 1, 2024 10:36am EDT",,"Archaeologists from the University of Aberdeen recently found an over 1,000-year-old ring during a volunteer dig near Burghead, Scotland. The university believes the Pictish ring means the ""painted ones."" A farming society dating back thousands of years was discovered in Morocco, in an archaeological site that spent many years unexplored. The archaeological site of Oued Beht in Morocco was first uncovered in the 1930s, according to a study published on July 31, 2024, in the journal ""Antiquity."" After the site was first discovered, it spent many years mostly untouched. The Oued Beht site, near Rabat, was explored by archaeologists, who found many pieces of evidence to show the area as an ancient farming society. (Arterra/Marica van der Meer/Universal Images Group via Getty Images) MOM, SON DIG UP ANCIENT OBJECT OFTEN FOUND NEAR BURIAL GROUNDS WHILE GARDENING In 2021, new fieldwork commenced, conducted by the British-Italian-Moroccan Oued Beht Archaeological Project (OBAP). The findings presented strong evidence that the area was once used for farming. Carbon dating of charcoal and seeds that were removed during excavations, mostly from deep pits, dated the site back to 3400 B.C. to 2900 B.C., per the study. The site is ""currently the earliest and largest agricultural complex in Africa beyond the Nile corridor,"" the study noted. Many artifacts came out of Oued Beht, including stone tools, axes and pottery. (iStock) ARCHAEOLOGISTS FIND SEVERAL ROCK CARVINGS OF ANCIENT BOARD GAME DATING BACK 4,000 YEARS Before this fieldwork, little was known about the people who lived in this area during the time period. ""For over 30 years I have been convinced that Mediterranean archaeology has been missing something fundamental in later prehistoric North Africa,"" Cyprian Broodbank, of the University of Cambridge and a leader in the research, said, per Morocco World News. ""Now, at last, we know that was right, and we can begin to think in new ways that acknowledge the dynamic contribution of Africans to the emergence and interactions of early Mediterranean societies."" Out of the archaeological site came pottery, chipped stone, axes and microlithics (stone tools), according to the published study. Additionally, there were several ""bell-shaped"" pits discovered in the excavation as well as the remains of sheep, cattle and pigs. The area studied by archaeologists was one not one previously explored. (iStock) CLICK HERE TO GET THE FOX NEWS APP There are strong commonalities with this particular site and ones aged similarly in Iberia, with numerous finds of African ivory and ostrich eggshells being uncovered, per the study, which has been an indication of the Iberians' connection to Africa. ""For more than a century, the last great unknown of later Mediterranean prehistory has been the role played by the societies of Mediterranean's southern Africa shores west of Egypt,"" the authors said of their recent findings, according to a press release, per Newsweek. ""Our discoveries prove that this gap has been due not to any lack of major prehistoric activity, but to the relative lack of investigation and publishing. Oued Beht now affirms the central role of the Maghreb in the emergence of both Mediterranean and wider African societies."" Ashlyn Messier is a writer for Fox News Digital."
"Thailand school bus bursts into flames outside Bangkok, 23 feared dead, officials say",More than 40 students and teachers were on field trip when bus burst into flames near Bangkok,,"October 1, 2024 9:18am EDT",,"25 feared to be dead after a school bus carrying children and teachers catches fire in a suburb of Bangkok. Nearly two dozen students and teachers in Thailand are feared dead after a school bus was engulfed in flames on Tuesday while traveling for a field trip on Tuesday, officials said. The bus was traveling from central Uthai Thani province to Ayutthaya and Nonthaburi provinces when the fire occurred on the outskirts of the capital Bangkok, Transport Minister Suriya Juangroongruangkit told reporters at the scene. Images captured at the scene show the flames engulfing the scorched bus as plumes of black smoke billowed into the air. ""Teachers told us that the fire ignited very quickly,"" acting police chief Kittirat Phanphet told reporters. ""From speaking to witnesses, we believe the explosion was caused by a spark from the tire that lit the gas cylinder that was powering the vehicle."" LOS ANGELES BUS HIJACKED AFTER ON-BOARD FATAL SHOOTING, SPARKING WILD POLICE CHASE Firefighters extinguished a burning bus that was carrying teachers and students from Wat Khao Phraya school on the outskirts of Bangkok, Thailand, on Tuesday. (REUTERS/Chalinee Thirasupa) He added that some students escaped through windows as the fire burned. Piyalak Thinkaew, a rescuer of the Ruamkatanyu Foundation, told reporters that 23 passengers – three teachers and 20 students – onboard the bus were missing and feared dead. It was earlier believed that 25 were feared dead, but Thinkaew said that two more survivors had been found. Rescuers said 20 students and three teachers were feared dead after the fire. (AP Photo/Sakchai Lalit) The students on the bus were reported to be in elementary and junior high school. THAILAND LEGALIZES SAME-SEX MARRIAGE, ALLOWS COUPLES TO WED STARTING IN JANUARY Juangroongruangkit said 16 students and three teachers were hospitalized and receiving treatment. Their conditions were unclear. Officials said the fire was believed to have been sparked after a tire exploded. (REUTERS/Chalinee Thirasupa) Phanphet said that an investigation is underway. Prime Minister Paetongtarn Shinawatra offered her condolences in a post on social media platform X, saying the government would take care of medical expenses and compensate the victims’ families. CLICK HERE TO GET THE FOX NEWS APP ""As a mother, I would like to express my deepest condolences to the families,"" she wrote. The Associated Press contributed to this report."
"Flooding, landslides kill nearly 200 in Nepal",Most of the deaths were reported in Kathmandu,,"September 30, 2024 3:59pm EDT",,"Fox News Flash top headlines are here. Check out what's clicking on Foxnews.com. The number of people killed in Nepal by flooding and landslides triggered by heavy rainfall over the weekend reached 193 while recovery and rescue work stepped up on Monday. Many of the deaths were in the capital, Kathmandu, which got heavy rainfall, and much of southern part of the city was flooded. Police said in a statement that 31 people were still reported missing and 96 people were injured across the Himalayan nation. A landslide killed three dozen people on a blocked highway about 10 miles from Kathmandu. The landslide buried at least three buses and other vehicles where people were sleeping because the highway was blocked. Kathmandu had remained cut off all weekend as the three highways out of the city were blocked by landslides. Workers were able to temporarily open up the key Prithvi highway, removing rocks, mud and trees that had been washed from the mountains. RESCUE MISSIONS UNDERWAY IN NORTH CAROLINA AFTER HURRICANE HELENE BRINGS ‘HISTORIC’ FLOODING, LANDSLIDES The home minister announced temporary shelters would be built for people who lost their homes and monetary help would be available for the families of those killed and to the people who were injured by the flooding and landslides. In this aerial image of the Kathmandu valley, Bagmati River is seen flooded due to heavy rains in Kathmandu, Nepal, Saturday, Sept. 28, 2024. (AP Photo/Gopen Rai) Prime Minister Khadga Prasad Oli was returning home Monday from attending the U.N. General Assembly meeting and has called an emergency meeting, his office said. Improved weather has allowed rescue and recovery work to be stepped up. Residents in the southern part of Kathmandu, which was inundated on Saturday, were cleaning up houses as water levels began to recede. At least 34 people were killed in Kathmandu, which was the hardest hit by flooding. Police and soldiers were assisting with rescue efforts, while heavy equipment was used to clear the landslides from the roads. The government announced it was closing schools and colleges across Nepal for the next three days. The monsoon season began in June and usually ends by mid-September. Meanwhile, in northern Bangladesh, about 60,000 people were affected by flooding in low-lying areas because of rains and rising water from upstream India. People have taken shelter on roads and flood protection embankments in Lalmonirhat and Kurigram districts, the English-language Daily Star reported. The River Teesta that crosses the border was overflowing at some points and the Dharala and Dudhkumar rivers in the Rangpur region were rising but remained below danger levels, the Dhaka-based Flood Forecasting and Warning Center said Monday. Waters could start receding in a day or two, it said. CLICK HERE TO GET THE FOX NEWS APP Bangladesh is a low-lying delta nation crisscrossed by about 230 rivers, including more than 50 that cross borders."
10 light options to brighten up your home as nights grow longer,Brighten up your space with these light fixtures,,"September 30, 2024 11:21am EDT",,"Add some extra lighting to all the rooms in your home.  (iStock) Now that the sun is setting earlier and earlier, you need to brighten up your home with some mood lighting. Whether you want to brighten up your kitchen so you can cook late into the night or show off your style with some new table lamps, this list has options for every room in your house. If you’re an Amazon Prime member, you can get these items sent to your door ASAP. You can join or start a 30-day free trial to start your shopping today. Original price: $36.99 Light up your kitchen with lights under the cabinets.  (Amazon ) Lighting under your cabinets brightens up your kitchen and makes prepping and cooking food easier. These cabinet lights from Amazon can be attached to your cabinets via a magnet or adhesive and are motion-censor, so you never have to feel around the kitchen walls for a switch again. You can also get light strips from Home Depot that you can stick under the entire length of your cabinets. They have an adhesive on the back, so you can make any design you’d like. 10 CANDLES THAT WILL TURN YOUR HOME INTO A COZY FALL PARADISE Original price: $27.99 Light up your desk without taking up space.  (Amazon ) Brighten up your workspace wherever you are with a clip-on desk lamp. Amazon and Walmart have clip-on lamps that can light an entire room or just your workspace. You can choose from multiple brightness settings and pick from cool and warm light settings. Original price: $32.99 Grab some new lamps for your living room.  (Amazon ) Need more lighting in your living room? A tall living room lamp can light up the whole room. There are options for every taste and style preference. You can go modern with this lamp from Amazon or choose a rustic look like this lamp from Wayfair. Make your stairs easier to walk up and down at night.  (Amazon ) Make your staircase safer with some motion-sensor lighting that turns on as you walk up and down the stairs. You can get a set of lights with adhesives from Amazon and Wayfair. Original price: $359 Add some class to your home with a new chandelier.  (Wayfair) A chandelier brings a certain level of class to a room. There are hundreds of options available, so you can easily style your new chandelier however you’d like. For a simple, classic chandelier, Wayfair has what you’re looking for. You can find more ornate glass chandeliers at Lamps Plus. DECLUTTER YOUR HOME WITH THESE 10 ORGANIZATIONAL ITEMS Original price: $99.99 Cool off your home while lighting it up at the same time.  (Amazon) A ceiling fan with built-in lighting is ideal for kitchens, living rooms and any other room that needs added airflow and extra lighting. Amazon has a small metal lamp for a modern feel and Lowe's has a more classic fan option with wood blades and a bright center light. Original price: $29.99 Control all the lights in your house with smart light bulbs.  (Amazon ) Smart bulbs can be controlled via Google, Alexa and other smart devices. With an app on your phone or voice control, you can turn your lights on and off, dim them or set them on a timer. Find smart light bulbs on Amazon or Home Depot. Pendant lights add style and light to various rooms.  (Amazon ) Pendant lights provide a concentrated light that many people choose to put over their sinks in the kitchen. Amazon has a three-pack of metal pendant lights in a variety of different finishes. Wayfair also has beautiful pendant lights that have glass shades. Original price: $16.99 Add some additional light in your living room with TV backlights.  (Amazon ) Lights on the back of your TV add extra lighting to your living room without taking up much space. You can often change the color of these lights for added ambiance. Amazon has a set of lights you can easily stick to the back of your TV and change with a remote. Or, you can get a light bar from Govee that you can stick on your TV stand or behind the TV. For more Deals, visit www.foxnews.com/category/deals Table lamps add concentrated light in your living room or office.  (Amazon ) Table lamps are ideal for living rooms and libraries. Not only do they add light to a room, but they also can be a style statement. Find metal industrial lamps on Amazon or a farmhouse-style set. If you want a basic set of black lamps, there are these from Wayfair."
