header,author,publish_date,category,summary,text
"The best things to do, hear, see or watch in Europe this week",Amber Louise Bryce,"26/10/2024,9:40 GMT+2",Culture news,"Exhibitions from Tim Burton and Superflat supremo Mr., Venom returns to cinemas and new album releases from the Pixies and Laura Marling - here's what to consume in Europe this (extra spooky) week.","Happy Halloween, guys and ghouls [insert maniacal laugh]. Ok, so it's technically not Halloween yet, but seeing as this is the last digest before the year's spookiest evening, we're bringing you a special edition tinged with terror and terrible puns. Fans of Tim Burton have a lot to scream about, with the final stop of his world-touring exhibition arriving in London. Also in London - a fantastic new show by the artist Fin DAC that celebrates his creative influences (although it ends 26 October, so be quick!) Elsewhere, Dutch Design Week continues, while a groundbreaking new retrospective in Venice focuses on Op Art pioneer Marina Apollonio. If you'd prefer to hide away in the cinema, we'd recommend Smile 2 for some seasonal scare-themed viewing - or there's the newly released Venom: The Last Dance for pure escapism. Whether you're heading to a costume party, carving pumpkins or just turning off all the lights and tucking into toffee apples, have a lovely weekend - filled with treats only. ‘The World of Tim Burton’ at the Design Museum (London, UK) Nothing says “it’s showtime” on spooky season like a Tim Burton exhibition. From Beetlejuice to Edward Scissorhands to Corpse Bride to so many more, the filmmaker has crafted some of modern cinema's most iconic and idiosyncratic movies, defined by their unique kooky goth aesthetic. Fresh off his most recent release, Beetlejuice, Beetlejuice, Burton has leant his personal archive of drawings, paintings, photographs, sketchbooks, set and costume designs, and more to London’s Design Museum. This vast and varied exhibition explores the evolution of a creator's aesthetic, tracing Burton’s personal life through to his modern day career. It’s an absolute must-see for fans - and also the final showing of what has been a decade-long world touring exhibit, ending 21 April 2025. Marina Apollonio: ‘Beyond the Circle’ at the Peggy Guggenheim Collection (Venice, Italy) The Italian artist Marina Apollonio has always understood the shape of things to come, a pivotal figure in the Op Art and kinetic art movements of the 60s. Her spiralling geometric designs that swallow your sight with optical illusion have become defining pieces of 20th century art, given major recognition after American art collector Peggy Guggenheim commissioned a piece in 1968. Coming full circle, it’s appropriate then that this retrospective of Apollonio’s works now be on show at the Peggy Guggenheim Collective. Hundreds of paintings, sculptures, drawings, chromatic experimentations and more contextualise Apollonio’s career from 1963 to the present day. For those in the know and newbies alike, it’s a fantastic way to experience such influential art while learning about the artist behind it all. On until 3 March 2025. Mr.: 'Those that Bring Color to Life and Living' at Lehmann Maupin's Cork street pop-up (London, UK) Best known for his Superflat style involving shaped-canvas paintings infused with anime and manga, Japanese artist Mr. is a former protégé of Takashi Murakami, concerned with exploring Japanese culture and its undercurrents of obsessiveness, commercialisations, consumerism and fetishisation. In this debut solo UK show, both print and motion works collaborate and contrast to create a contemporary contemplation of the circulation of pop culture imagery, its role in escapism and how it helped define postwar Japanese youth culture in particular. On until 16 November 2024. Venom: The Last Dance The sticky black liquid antihero is back for this third instalment in the Venom series, following 2018’s Venom and 2021’s Venom: Let There Be Carnage. Tom Hardy plays the pivotal role as Eddie Brock, the unfortunate host to our alien symbiote after it tried (and failed) to bond with Spiderman prior (remember Toby Maguire’s ‘dark spidey’ rizz in Spider-Man 3?) Picking up from the events of the last movie, in which the pair took on a red symbiote named Carnage, wrecked everything in the process (these poor city councils in superhero land, honestly) and went on the run from authorities. As with all Marvel films, expect sardonic quips, high-octane action and slimy special effects that bring this particular franchise to a fitting finale - for now. Three Kilometres to the End of the World Here’s a film festival gem you might not have heard of - and one that should definitely be on your watchlist. Directed by Emanuel Pârvu and set in a remote Romanian village, it’s an astute observation of a family caught in the throes of various struggles. Dragoi (Bogdan Dumitrache) is saddled with debt and then discovers his 17-year-old son Adi (Ciprian Chiujdea) is gay - something he responds to badly. What unfolds is a tense exploration of community-formed bubbles, and the ways in which their deeply embedded strictures and stigmas can tear us into two. Our reviewer David Mouriquand selected it as his Film of the Week and wrote: ""Trei kilometri până la capătul lumii (Three Kilometres to the End of the World), shows that the actor-turned-director is one of the brightest stars of the new wave of Romanian filmmaking."" Read his full review here. The Room Next Door Beginning its European rollout in Spain and now the UK and Germany, Almodóvar's first English-language feature film (and Golden Lion winner at Venice Film Festival) is a powerful portrait of life, death and the unbreakable bonds that help us to navigate it all. Based on Sigrid Nunez's novel, ""What Are You Going Through"", it focuses on the relationship between two old friends: Ingrid (Julianne Moore), an autofiction writer who is terrified of death, and Martha (Tilda Swinton) who has terminal cancer and makes the decision to end her life with a euthanasia pill. Powerful and pop-coloured, it’s an important watch buttressed by great lead performances, even if some of the emotional authenticity gets lost in translation at points. Read our full review here. ‘The Disappearance of Kimmy Diore’ (Disney+) Investigating the case of a kidnapped 6-year-old YouTuber named Kimmy, detective Sara Roussel (Géraldine Nakache) soon finds herself immersed in the seemingly superficial world of social media influencers, within which lurks a sinister underbelly of deception and conceit. Fresh feeling and highly bingeable, this French crime drama tackles a growing topic of concern: the exploitation of child ""influencers"" who are managed by their parents - and its potentially catastrophic effects. 'Rivals' (Disney+) Is it just us or is it warm in here? Another TV recommendation from Disney+ — and it's a steamy one. Based on a 1988 novel of the same name by Jilly Cooper, this raucous romp of a show centres on a rivalry between Rupert Campbell-Black (Alex Hassell) and media mogul Lord Tony Baddingham (David Tennant), all set to the hot and heavily hair-sprayed garish kitsch of the 80s. The cast is stacked, also featuring Katherine Parkinson, Danny Dyer and Emily Atack, but the main pull is all the sexy bits (and there are many), providing pure soapy silliness that comes together (literally) as the perfect bed-rot-and-soul-cheer viewing. Laura Marling: ‘Patterns in Repeat’ Laura Marling is one of those rare singers that can capture such gentle folky warmth with sharp poetic profundities in her music. First discovered as a teenager, Marling has gone on to produce eight studio albums, with 'Patterns in Repeat' being her newest - following the 2020 release of 'Song for Our Daughter'. In the time between the two, she gave birth to her daughter, writing music about the experience of motherhood and personal revelations that have come with it. The sound is awash with silky emotion and lulling melodies that give you goosebumps. Read our full review here. Pixies: ‘The Night the Zombies Came’ It's difficult to remain cool - especially if you're a defining band of the 90s alt-rock scene, enshrined in a specific period of success that harshens and heightens attempts to evolve outside of it. Unfortunately for the Pixies, this trope has proven true, with much of their album releases since reuniting in 2004 proving unmemorable and critically dismissed. Their latest - the appropriately Halloweeny titled 'The Night the Zombies Came' - feels like a return to more familiar ground and trademark haunted sound; moody surf rock for vibing out in cigarette butt-strewn basements. Lady Gaga: 'Disease' ‘Little Monsters’ (the name for Lady Gaga fans FYI) will be roaring with excitement as the singer has released the first single from her upcoming album (rumoured to be called 'Nightingale'). It's her first pop single in a while, with 2020's 'Chromatica' being the last and two jazz records following: 2021's 'Love for Sale' and her recently release companion piece to Joker: Folie à Deux, 'Harlequin'. To be fair, she's been busy - but the good news is, Gaga's return to dark dance-pop screams with haunted house party fun - and is much more likely to inspire ""a happy face"" than Joker 2."
The year of elections: What can Trump learn from Europe as he fights for Gen-Z voters?,Boyd Wagner,"25/10/2024,18:26 GMT+226/10/2024,9:43 GMT+2",World,"National Rally and AfD, once unacceptable to young voters, have managed to reach them and win them over with savvy social media strategies.","It's been dubbed ""the year of the election"". Throughout 2024, democracies across the west have seen millions of voters cast votes already this year — and on 5 November, the world’s oldest continuously operating democracy, the US, will elect a president, the entire House of Representatives and one-third of its Senate. With many of the same issues attracting the focus of politicians, parties and voters on both sides of the Atlantic, Euronews asks: What can Europe’s myriad elections in 2024 tell us about the upcoming vote in the US? This past April, as the European Parliament elections were ramping up, Germany’s 66-year-old chancellor, Olaf Scholz, created a TikTok account. After years of ignoring the fast-growing Chinese social media platform, the German leader joined TikTok in hopes of gaining support with Germany’s younger voters. “Go where the citizens are and inform them there,” was the rationale laid out by government spokesperson Steffen Hebestreit. TikTok is the largest online platform for members of now-voting eligible Generation Z. More than 70% of “Zoomers” worldwide use TikTok, far outstripping the general population. And the platform has been key to the growth of various far-right parties throughout Europe, including Germany’s Alternative for Germany (AfD) and France’s National Rally (RN). Keen to improve its image with Germany’s youth, AfD has worked tirelessly to become TikTok’s most active political party in Germany, and controversial party leaders including Maximilian Krah have gained large followings over the past year by posting short videos with a large reach. With June’s EU vote and a series of German state elections now in the rearview mirror, it appears the strategy worked. In June, AfD grew its share with voters 16-29 years old by 11 points compared to the 2019 EU elections — and in September’s regional election in Thuringia, 38% of voters under 25 years of age voted for AfD, more than double the result of the age group's second choice of party, Die Linke. In France, meanwhile, a similar rightward trend among young voters is coming into view. Marine Le Pen’s young protégé, RN leader Jordan Bardella, is another keen user of social media, and his profile was crucial to RN’s growth in 2024. With 2 million TikTok followers, Bardella is the third most followed French politician on the platform, trailing only President Emmanuel Macron (5 million) and left-wing firebrand Jean-Luc Mélenchon (2.6 million). But the devil is in the detail, and Bardella’s account has more likes and higher engagement rates than his competitors. Once viewed as too extreme to govern, RN has benefited from a combination of strategic rebranding as well as the age-old factor of time, and its relative successes in 2024 have clearly been bolstered by a surge in support among French youth. Despite the party’s controversial history and connections to past fascist movements, many young French voters see RN as an alternative to the status quo of Macron’s liberal coalition or the smattering of left-wing parties that comprised the National Popular Front in this summer’s parliamentary vote. In June’s EU elections, RN achieved a historic percentage of the youth vote en route to their largest-ever allotment of MEPs. Exit polls showed that the far-right party gobbled up 32% of the under-35-year-old vote, while Macron’s coalition achieved just 5% of it. In the subsequent snap election for French parliament, RN found similar success with voters under 35. Like AfD, RN achieved this success partially by tailoring social media messaging for younger audiences, a strategy that allowed them to structure their ideological messages in a way that connected to younger voters. In essence, TikTok became a tool to shape existing narratives into a message that connected with the issues plaguing many of Europe’s young people. One of AfD’s most common campaign themes over the past year has been “peace in Europe”. Critics in Germany and across Europe have lambasted the German party for being pro-Russian. Yet AfD’s leaders have successfully used TikTok and other social media platforms to argue that young people's lives are being made harder because Germany’s government and establishment parties are focusing instead on non-German issues such as Russia's full-scale invasion of Ukraine. European-wide issues, such as the housing crisis, stagnant wages and poor job opportunities, were wrapped into a singular message that if peace in Europe can only be achieved, then young voters' immediate problems could be fixed. The same tactic was used to campaign on migration, which both AfD and RN connected to the many obstacles in young voters' lives. In 2019, climate change and environmental concerns drove many young European voters to support green and liberal parties across the EU. But while a study by the Institute for Global Affairs shows that environmental issues remain a top priority for younger voters, the lines are less clear than they were five years ago. Today, “poor decision-making by the political elite” has risen to become younger voters' second-biggest concern — followed by migration. This shift has presented a unique opportunity for Europe’s right, signalling that younger voters have become increasingly diverse in their priorities. It's not just France and Germany showing this trend. In the Netherlands, Greet Wilders and his Freedom Party increased the youth vote by 7% in their election win last year. In Portugal, far-right party Chega jumped to a comfortable third-place position in Lisbon’s Parliament, partially riding a social media-driven campaign geared towards younger voters upset with the establishment. Far-right parties from Spain to Finland have also enjoyed greater-than-normal levels of support from young voters. With establishment centrist or left-wing parties still in control in many capitals across Europe, including Brussels, the shift is unlikely to stop. If confidence continues to wane in Europe’s governments, far-right parties will continue to present an alternative for young voters seeking a change to the status quo. Citizens of the US face many of the same key issues as their counterparts in Europe, with housing costs, stagnant pay and inflation have all created major issues for younger voters. And US strategists on both sides of the aisle have recognised this. For the last 60 years, the US youth vote has reliably gone to the Democrats. In many elections, Democratic campaigns have depended on driving up the under-35 demographic to win narrow outcomes. That much was true in 2020, Joe Biden won the youth vote by a margin of 61-36 — an 11-point improvement on Hillary Clinton’s result in 2016. Given the narrowness of the 2020 result, high youth turnout for Biden arguably won him the election. This year looked more difficult. Before the president dropped out of the race in July, a smattering of polls conducted between May and July showed Biden still leading Trump among the youngest voters, but only by small margins; one PBS poll from June even showed Trump ahead of Biden when including other candidates, such as RFK Jr (now no longer running) and the Green Party's Jill Stein. The numbers were jarring for the Democrats, and may have played a role in convincing the president to step down from his re-election bid. Since accepting the Democratic nomination in the summer, Kamala Harris has made strides in recapturing young voters. A new CNBC poll shows that Harris is back to leading with voters under 34 by a 20% margin, 60%-40% — numbers more in line with the 2020 result. However, data for young voters tends to be more variable and less reliably predictive than with other demographics, and that has thrown up conflicting polling results. According to a September SurveyUSA poll, Trump held a four-point advantage with Gen-Z voters, beating Harris 50-46. And in the key swing state of Arizona, where Biden won an ultra-narrow victory in 2020, Harris is struggling with the youth demographic. A recent New York Times/Siena College poll found her leading Trump by just 9% with voters under 30 in the state — and the same poll put Trump ahead by 5 points in the state as a whole. The tightening youth vote shows an ongoing trend reminiscent of Europe. As young European men lead the shift right, the trend is even more noticeable in the US. While the US' young women remain strongly liberal, driven largely by the crucial issue of abortion rights, young men are growing more conservative. In 2022’s midterm elections, Gen-Z women voted Democratic at a 72% rate. In that same election cycle, Gen-Z men split almost evenly, with 52% voting for the Democrats. The Trump campaign sees the trend. In recent months, the former President has made guest appearances on an array of podcasts with audiences comprised largely of young men. This week, it was announced that Trump would be a guest on Joe Rogan’s podcast. Rogan is a culturally important figure, especially for many young men, with over 11 million listeners per episode. Still, the path to winning “Zoomers” remains an uphill battle for the Republicans. Unlike Europe’s left, Harris and the Democrats lead the battle on social media, especially TikTok. Despite major investments made by Trump’s campaign, the former president remains less popular there: negative-Trump posts on the platform outweigh negative-Harris posts by a 2-to-1 margin, according to Pew Research, while 55% of US TikTok users identify as Democrats and just 39% as Republicans. However, in an election that could come down to just a few thousand voters in a handful of states, every vote matters. And if the trend we saw in Europe continues in the US, Trump may only need to peel 5-15% of Gen-Z voters away from the left to shift the outcome in his favour. This is part two of a two-part series where Euronews explores the similarities between Europe and America’s 2024 elections. Read the first part on how European elections highlighted voter dissatisfaction and a shift towards anti-establishment parties, a trend that could influence the US elections, here."
Springsteen blasts Trump while Beyoncé expected at today’s Democrat rally in Texas,David Mouriquand,"25/10/2024,10:38 GMT+211:22",Culture news,"Beyoncé is reportedly heading to Houston to take part in today's rally for Kamala Harris. Last night, Bruce Springsteen played at a Harris rally in Atlanta, and called Trump a tyrant - echoing the recent comments made by General John Kelly, who said that Trump fits the definition of a fascist.","Following a greatest hits performance from Bruce Springsteen at Kamala Harris’ rally in Atlanta last night, only days after publicly endorsing her, Beyoncé is expected to appear today in her hometown of Houston at a rally for Harris. Harris' presidential campaign has taken on Beyonce's 2016 track 'Freedom' as its anthem, and the singer's planned appearance brings a high-level of star power to what has become a key theme of the Democratic nominee’s bid: freedom. Harris heads to the reliably Republican state today just 10 days before Election Day in an effort to refocus her campaign against Donald Trump on reproductive care. Harris’ Houston trip is set to feature women who have been affected by Texas' restrictive abortion laws, which took effect after the Supreme Court overturned Roe v. Wade in 2022. Harris has centered her campaign around the idea that Trump is a threat to American freedoms, from reproductive and LGBTQ rights to the freedom to be safe from gun violence. At yesterday’s rally, Springsteen slammed Donald Trump: “I want a president who reveres the Constitution, who does not threaten but wants to protect and guide our great democracy, who believes in the rule of law and the peaceful transfer of power, who will fight for a woman’s right to choose, and who wants to create a middle-class economy that will serve all our citizens.” He added: “There is only one candidate in this election who holds those principles dear: Kamala Harris. She’s running to be the 47th president of the United States, Donald Trump is running to be an American tyrant. He does not understand this country, its history, or what it means to be deeply American. That’s why on November 5th, I’m casting my vote for Kamala Harris and Tim Walz.” Springsteen’s tyrant comment echoes deeply at the moment, especially after the recent comments made by General John Kelly, who served under Trump as his chief of staff. Kelly said in a New York Times interview that Trump fits the “general definition of a fascist” and confirmed the Republican candidate's fascination with Adolf Hitler. ""He commented more than once that, 'You know, Hitler did some good things, too.'"" In a separate interview with the Atlantic, Kelly described how Trump demoaned that he did not have generals who were loyal in the way he believed military commanders had been to Hitler. His statements have propelled the issue of fascism to the forefront of the US presidential election, with Kamala Harris amplifying Kelly’s comments during a CNN town hall meeting. She said that it was “deeply troubling and incredibly dangerous” that he would “invoke” Hitler, and later told moderator Anderson Cooper that she agreed that Trump was a fascist. Trump hit back at Kelly on his Truth Social platform by calling him a “degenerate” and a “low life”, while also inaccurately accusing Harris on X of calling him Adolf Hitler, when it was Kelly who made the direct reference. His X post accusing Harris of “going so far as to call me Adolf Hitler, and anything else that comes to her warped mind”, because, he claims, polls indicate she is losing, has received more than 28 million views as of writing. Beyoncé is expected at Harris' Houston rally today, while Bruce Springsteen is next scheduled to appear at Harris’ Philadelphia rally on Monday 28 October."
,,,,,
