header,author,publish_date,category,summary,text
"Euroviews. 
            
		Russia wants the world divided and in conflict. NATO cannot let this happen","Matas Maldeikis, Lithuanian MP, Deputy Chair of Future Committee, European Affairs Committee member","24/09/2024,17:43 GMT+2",Europe Decoded,"Russia wants to keep NATO solely focused on the developments in Ukraine, making us oblivious to his imperialist plans elsewhere, Matas Maldeikis writes.","Lithuania has been steadfast in its support for Ukraine. It remains in the top three largest donors by GDP of all NATO nations and its people understand more than most the threat Russia represents. Since the fall of the Soviet Union, we have witnessed Russia becoming progressively authoritarian under Vladimir Putin’s leadership. His objectives remain the same as under the former communist bloc: disrupt, expand and influence. These geopolitical games for power are being played beyond Europe, including in the nations of the ""Global South"". Putin hopes that by pressuring these rapidly developing countries, he can create new diplomatic rifts between them and the West. With division comes an opportunity for Putin to split global support against his invasion of Ukraine and build a new network of Russian client states. The fragile nation of Libya is the most prominent example of this and the launchpad for much of Russia’s campaign in sub-Saharan Africa. Since the fall of Muammar Gaddafi in 2011, Libya has struggled to find a democratic footing. Conflict constantly looms between rival governments and strongmen vying to control Libya’s abundant oil and gas resources. Russia has taken advantage of this instability and has increased its engagement with the predominant strongman in the east of the country, General Khalifa Haftar, who leads a large militia known as the Libyan National Army (LNA). To realise this ambition of a Libyan client state under the Haftar clan, Russia has reinforced Haftar’s nefarious activities, including fuel smuggling and currency printing and has commenced discussions to escalate the military partnership through a Russian nuclear submarine base at the port of Tobruk. Not only do these developments pose direct economic threats to European energy assets and supplies, but they also present military threats, as the Mediterranean will be opened to Russian forces. As a nation, Libya is of key strategic import to Putin. He sees its proximity to southern European states like Italy and Spain and knows influence over important energy resources can be used to leverage European energy and foreign policy. Libya remains the starting point for most migration journeys into Europe — something further conflict in the country will only increase. Combined with its wealth of resources, Libya could not be a more attractive platform for Russia to base its operations in Africa, and connect them with supply routes in Syria. Libya has proved to be an ideal funnel for Putin to insert his Russian mercenaries, driving Russian proxy forces into the heart of Africa. Sudan, Mali and other Sahelian states have all felt these repercussions as Russian fighters, bent on mayhem, are let loose alongside militias, juntas and rebel forces. This game plan is already delivering returns in countries such as Niger and Mali, whose upstart military governments have also recently severed ties with Ukraine. To expand this corridor of chaos in Libya, Putin has looked to hold sway over important national institutions. The National Oil Corporation (NOC), under Chairman Ferhat Bengdara, is continuing to succumb to the corruption enabled by the divisions in the country, with billions of dollars of public funds still unaccounted for, helping drive the much relied upon Libyan oil industry into the ground. In the past few weeks, an escalation from Haftar’s forces has brought new uncertainty to European energy security as vast oil fields like El Sharara are blockaded and closed by his LNA, with a slow and limp verbal response from his allies in the NOC. As more of Libya falls under the influence of Haftar, there is a real prospect of it becoming a vassal state for Putin. Russia wants to keep NATO solely focused on the developments in Ukraine, making us oblivious to his imperialist plans elsewhere. NATO must remain united in the face of growing energy security challenges and work collectively in our ambitions to support efforts against these geopolitical games. Only then can we ensure that Russia feels the full force of international sanctions and that our allies in Ukraine are successful. Matas Maldeikis is Deputy Chair of Future Committee and member of the European Affairs Committee in the Lithuanian Seimas. At Euronews, we believe all views matter. Contact us at view@euronews.com to send pitches or submissions and be part of the conversation."
'HomEage': Fin DAC celebrates his creative influences in new half-and-half portrait series,Theo Farrant,"23/10/2024,14:00 GMT+2",Art,"Fin DAC is set to unveil his latest show, featuring half-and-half portraits that blend his unique style with the iconic aesthetics of influential artists like Yayoi Kusama, Pablo Picasso and Jean-Michel Basquiat.","David Bowie once said: ""The only art I'll ever study is stuff that I can steal from."" It’s a cheeky quip, but there’s a grain of truth to it: all art borrows, bends, and blends. And no one’s owning this notion better right now than Fin DAC. While many creatives try to sneak in their influences and hope no one notices, the Cork-born, London-based artist is putting them front and centre in his latest project, HomEage. The series features striking ""half-and-half portraits"", fusing his signature aesthetic with that of the legends who have shaped him, from the likes of Pablo Picasso, Andy Warhol to Frida Kahlo and Sex Pistols artist Jamie Reid. ""The artwork is split down the middle, with the second half repainted in the style of another artist. It looks like two different versions or personalities of the same character,"" explained DAC from his studio in Mile End, London. He added: ""With this project, there’s no hiding - it's all out there. It’s meant to celebrate those influences and those artists."" Renowned for his larger-than-life outdoor street murals that can be found all over the world, HomEage marks DAC's first solo show since 2021, and is being held in at London’s St Martins Lane crypt gallery on 25 and 26 October. The project is also available in book form from the West Contemporary Editions website. Euronews Culture sat down with DAC before the show's unveiling to discuss everything from his journey to becoming a full-time artist at 40, the impact of AI in the art world, and his creative process for creating gigantic murals. Euronews Culture: How did you become a full-time artist? Fin DAC: My career as an artist started super late, when I was around 40. I had just come out of a fairly stressful relationship, and I essentially wanted something to take my mind off what I was going through at the time. I used to draw as a child, and I have memories of being alone in my room, completely content just doing that. So I thought, okay, if I start to draw and paint, that might give me that kind of meditation or therapy. And it’s true - it silences the world completely. Painting seemed like an easy route to take. Even if I didn’t become a full-time artist, it didn’t matter. I was content in my job as a web designer and developer at the time. But once I really got into painting, it snowballed quickly; I became a full-time artist within 2 or 3 years. Tell us more about your latest project 'HomEage'. It’s essentially about split personalities. The artwork is split down the middle, with the second half repainted in the style of another artist. It looks like two different versions or personalities of the same character. It started as an interim project back in 2020 during the first pandemic lockdown in California. Being away from home and not seeing my family made me think a lot about home. The first four pieces I created focused on artists who inspired me and were my favorites. Once those were done, I found the process so interesting that I kept going over the last few years. The second batch of four focused specifically on New York artists from the 1980s, like Warhol, Basquiat, and Haring - everyone knows their names, even if you’re not into art. I kept adding more and more names to the list. Many artists pretend they’ve come up with everything themselves, but nobody does that anymore. Everybody takes influence from somewhere; it’s just about how well you can hide where those influences come from. With this project, there’s no hiding - it's all out there. It’s meant to celebrate those influences and those artists. I wanted to see if I could incorporate both our styles in some magical way. I’m not sure I succeeded, but I gave myself the opportunity to learn. The show is being presented in an underground crypt. What’s the significance of that? That decision was made by West Contemporary, who are hosting the exhibition. We wanted to find an old venue with a history because this is an art history project at its essence. We aimed to find a location that fed into the concept of history and the idea that this old building is now being reused for something completely different from its original purpose. It’s taking on another character, which is essentially what I’m doing with the artworks - creating another character. What do you hope audiences take from this exhibition? Honestly, I don’t know. We’re really doing the exhibition just so people can view the works. The way I’ve run my career would be considered at odds with how most artists approach theirs. I’m not particularly interested in doing shows or in gallery representation. I don’t care about being shown at Basel or Frieze Art Fair; it’s just not on my list of priorities. If it happens, great, but essentially everything I do is according to how I want to do it, and hopefully, people will follow along for the ride. You’re renowned for your large-scale murals. How has it been focusing on smaller-scale canvases and paper? Honestly, the bigger pieces are easier. When painting a piece for a gallery, I know someone is going to get very close to it, so I have to be much more of a perfectionist compared to a wall mural. Generally, with a wall, people aren’t looking at the details; they’re impressed by the whole thing. They’ll take a photo, post it on Instagram, and that’s enough for them. Once you get over the technical aspect of scaling the image up, which street artists have mastered over the years, I find it easier and much more enjoyable. How would you describe your style and the aesthetics of your work? I call it ""urban aesthetics,"" which is more of a label. This term originates from a group of creatives in the early 20th century who believed that art and design should focus solely on beauty rather than socio-political commentary. When I began painting, most of the surrounding work had a Banksy-esque style - socio-political commentary, political jokes, and so on. I didn’t want my work to be that way. When I learned about the aesthetics movement, their motto resonated with me because I want my art to focus on portraiture and beauty, depicting women as they might have been represented throughout art history. The mask is a recurring theme in your work. What's its significance? I can’t tell you that. Or I’d have to kill you... No, there are only two people in the world who know the true meaning of the mask. The shape of it relates to superhero themes and hidden identities, but the elements of the mask have specific meanings that I don’t reveal. All art should be open to interpretation. If there’s a mystery and you can’t find out the answer, it remains intriguing. Once the answer is revealed, it loses interest and people move on. How do you actually execute these massive murals. Could you walk me through the process, from the idea to the final execution? I like to work in environments where I can adapt the building to the art or vice versa, using architectural elements to inform my design. However, those projects are quite difficult to find. In terms of concepting, I prefer not to plan before arriving at the location because I want the environment and light to influence what I'm creating. In terms of execution, different artists have their methods, but I use a technique called the squiggle method. I learned it from an Australian artist named RONE, who suggested it would really help improve my work. The squiggle method involves painting random lines, smiley faces, letters, and numbers all over the wall, then taking a photograph. I import that image into Photoshop or another app and overlay the image I want to paint, using those chaotic lines as a sort of distorted grid to map out where, in my case, the portrait will go. When working on a 200-foot tall wall, you can't guarantee that your lines will remain parallel or horizontal. By using the squiggle grid, I can reference features like a nose, knowing its relationship to nearby elements. For example, I can pinpoint where the nostril goes because it aligns with a specific mark. If I had a traditional grid, the entire nose might fit within one square, but I wouldn't have anything to connect the nostrils to smaller features. This method is clever and works perfectly every time. What's the largest mural you've done to date? I think the largest was a portrait of Frida Kahlo that I painted in Guadalajara, probably in 2018 or 2019. It's about 200 feet tall. What I love about it is that when you photograph the wall and cut out the background - like the buildings and skyline - it looks like it could be a piece on canvas. What motivates you to create such large-scale outdoor murals? The notion of large scale is secondary. When I started, I was painting small pieces in London; it’s about presenting your work differently than in a gallery. Many people feel uncomfortable in galleries and museums, often thinking they must buy something if they go. When you present art publicly, you’re open to the public's reactions, which can be good or bad. You have to accept that. I enjoy being out in public. I spent a lot of the last four years doing studio work, and while I don’t miss painting, I definitely miss traveling. Painting murals allowed me to travel to New Zealand, Australia, the US, and Japan, places where culturally you're going to find something different, however extreme that difference would be. You're also going to meet people who have different sensibilities to you because every single person who grows up in a country somehow has their personality morphed or molded by the country that they live in. What seems normal in England might not be the same in America. With street art, every artist has the same opportunity to showcase their work. For many it’s just about overcoming the fear of putting their art on the wall and the potential for negative reactions. A post shared by Fin DAC (@findac) What are your thoughts on the emergence of AI in the art world? For me, AI is just a tool. Some people will embrace it, others won't. Some claim it’s the end of the world for art, while others don’t. In the film industry, they said special effects would ruin it, but look at the highest-grossing films since their introduction. I think we have bigger issues to worry about in terms of AI, like warfare and global impacts. I’m neither for nor against AI; and I'm not concerned about its effect on my work. I have a specific brand, and while one might assume it could be easily replicated, I’m not worried. As an artist, if you’re not evolving, you’ll inevitably face copycats, whether they're using AI or not. It’s just the nature of art. What are you most proud of in your career so far? I've said this before - but just being an artist. I didn't start until I was 40 because I convinced myself that I had nothing to say or offer. You know, when you're growing up and you tell people you want to be an artist, the majority will say you need to get a real job. But what could be more real than doing something you love? Not only making money from it but also affecting people positively, hopefully. I had to overcome a lot of mental negativity. I had persuaded myself that I couldn't be an artist. The reason I became one was that I was in such a low place in my life that none of the negative chatter in my head mattered anymore. I wanted to paint just to get some form of calmness in my life. And it worked! HomEage, hosted by West Contemporary Art, is being held in at London’s St Martins Lane crypt gallery on 25 and 26 October."
Will the European Central Bank opt for a large rate cut in December?,Tina Teng,"25/10/2024,6:36 GMT+2",Economy,"Money markets see an increased likelihood of the European Central Bank (ECB) deepening its rate cuts in December following weak economic data. However, analysts expect the bank to maintain a gradual approach to rate reductions due to the persistent upside risks in inflation.","Market participants have raised their expectations for the European Central Bank (ECB) to take a significant step with its next interest rate move, following poor business activity indicators on Thursday. Money markets are now pricing in a 50% chance of the bank cutting the interest rate by half a percentage point in December. Meanwhile, ECB officials are divided on the necessity of such a large reduction. Major European government bond yields fell significantly after the weak October business activity readings in the manufacturing and services sectors on Thursday. Movements in bond yields typically reflect expectations of the ECB’s interest rate trajectory, particularly for short-term instruments. The yield on the 2-year German and French government bond, which is highly sensitive to interest rate changes, fell to yearly lows before rebounding, indicating that traders have increased their bets on a larger rate cut from the central bank. According to S&P Global’s flash estimates, the manufacturing Purchasing Manager Index (PMI) for both France and Germany has been contracting for more than two years in October, though Germany’s reading has improved. France’s services PMI is expected to slip back into contraction after two months of growth, suggesting that the boost from the Paris Olympics was temporary. This data, along with a sharp decline in headline inflation in September, has significantly raised the chances of the ECB delivering a steeper rate cut in December, following consecutive cuts in September and October—the first such moves in 13 years. The eurozone’s annual inflation fell to 1.8% in September, its lowest level in three years and below the ECB’s 2% target. However, core CPI, which excludes volatile items like food, energy, alcohol, and tobacco, remained relatively high at 2.7%. As such, the upcoming consumer price index for October, due next week, will be crucial for market sentiment. Michael McCarthy, market strategist and chief commercial officer at Moomoo Australia, said that eurozone inflation still presents “substantial upside risk.” He added: “Despite expectations, next week's core inflation reading for October is likely to show an increase in the year-on-year rate to 2.8% (from 2.7% previously),” and “If the increase exceeds consensus, there could be a sharp adjustment in interest rate markets.” ECB officials are divided over whether to implement a quarter-percentage-point or half-percentage-point cut, but all have expressed confidence that inflation will return to target. ECB President Christine Lagarde said in an interview with Bloomberg TV: “The pace will be determined based on backward- and forward-looking elements, using our three criteria and applying judgment.” Some Governing Council members, such as Mario Centeno from Portugal and François Villeroy de Galhau from France, argue that economic risks outweigh inflation risks. Meanwhile, others, including Klaas Knot from the Netherlands and Pierre Wunsch from Belgium, hold a more hawkish view, arguing that a 50 basis point cut is premature unless there is a further deterioration in the economic outlook. Slightly more officials favour a gradual approach rather than an accelerated step. In addition to inflation data, key eurozone economies will release their third-quarter Gross Domestic Product (GDP) figures next week, which will provide further insight into the region’s economic trajectory. The IMF has downgraded the euro area’s economic outlook to just 0.8% in 2024 and 1.2% in 2025, a 0.1% and 0.3% reduction from its July forecast. Dilin Wu, a research strategist at Pepperstone, wrote in an email to Euronews: “I believe the chances of the ECB cutting rates by 50 basis points in December are quite slim, especially after the back-to-back rate cuts.” However, she acknowledged the challenging economic conditions in the region: “A 50 basis point cut would represent a significant shift and could potentially trigger greater market turmoil.”"
