header,author,publish_date,category,summary,text
Isabelle Huppert awarded the Prix Lumière & 10 key takeaways from her masterclass,David Mouriquand,"19/10/2024,11:29 GMT+221/10/2024,15:56 GMT+2",Cinema,"Isabelle Huppert was awarded the coveted Prix Lumière. Euronews Culture attended the ceremony, as well as her masterclass. Here are the 10 things we learned.","To mark the 15th anniversary of the Lumière Film Festival, Isabelle Huppert was awarded the prestigious Prix Lumière at the traditional award ceremony, held last night at the Amphithéâtre 3000 in Lyon. With an audience including the likes of Alfonso Cuarón, Claire Denis, Noémie Merlant, Anthony Delon, James Franco, Emmanuelle Béart and Julien Clerc (who took to the stage to play his famous song ‘Ma Préférence’ in honour of the evening’s main star), Huppert came on stage to receive her prize. She joins an illustrious list of past recipients, including Martin Scorsese, Jane Fonda, Quentin Tarantino, Jane Campion, Pedro Almodóvar and Wong Kar-wai. “I was told that the Lumière prize was special, but it's much more than I could have imagined, and yet I have a lot of imagination,” she shared, visibly moved and referencing the honour of being awarded a prize so intimately linked to the history of cinema. Speaking about looking back at the past and looking to the future, she finally emphasised the importance of the present, “this joyous and wonderful moment full of emotion.” Check out this video for clips of the evening, as well as reactions from some of the celebrities present at the award ceremony last night, whom Euronews Culture got to interview. Prior to the awards ceremony, Huppert participated in a masterclass, a rare exercise for the actress, who isn’t a huge fan of discussing her work and career in public. The on-stage conversation was with Lumière Film Festival boss and Cannes chief Thierry Frémaux, with the likes of Claire Denis and François Ozon, who both directed Huppert in White Material and 8 Women, as well as Coralie Fargeat (The Substance) and Anthony Delon sitting in the audience. She spoke openly and candidly about her career. Here are the 10 things we learned at the masterclass: Cinephile? Huppert revealed that prior to starting her acting career, she had seen few movies. “It’s still the case to this day. We didn’t go to the cinema that much back in the day. I’d need to come back to Lyon and the festival more often,” she quipped. Film choices Huppert has worked with some of the most renowned and international directors, from Bertrand Tavernier, Claire Denis, Werner Schroeter, Michael Haneke, Joachim Trier, to Hong Sang-soo, Paul Verhoeven, Wes Anderson and Ira Sachs - to name but a few. “I don’t know if I know how to read scripts, but maybe I can recognise filmmakers and that matters obviously in the choices we make,” she said. “The choices are difficult, mysterious even. It’s a mix of many things. It’s pure intuition, ultimately.” She also revealed that when reading scripts, she would make her mind up based on a line that would stick with her. For example, in La Pianiste (The Piano Teacher), Michael Haneke’s 2001 erotic psychological drama, she honed in on the line: “La froideur, ça vous dit quelque chose?” (“What does coldness speak to you?”). Speaking of which... Restraint at all costs Huppert is not known as the ‘warmest’ on-screen presence, with many of her roles characterised as chilly, standoffish or even emotionally distant. However, this is by design. Referencing that quote from The Piano Teacher, she stated that it “sums up everything it means to be an actor.” “It may seem surprising, but when people think of acting, you may think of feelings, therefore of sentimentality, of something more rounded. But when you’re acting, you’re in a certain coldness,” she said. “When (her character in The Piano Teacher, Erika) sees the young man play, she understands that his way of playing will probably be his way of loving, something that doesn’t do justice to the beauty of the music and therefore of the feeling. I believe it’s the same when you’re acting - you need to be detached from what you’re playing to be a better actor.” “I like to approach every character I play with a distance, which often allows one to place humour into moments and roles where it is least expected. The Pianist is not really a comedy, to say the least, but there are some funny aspects to it...” Speaking of Haneke... Near misses Huppert almost never worked with the celebrated Austrian filmmaker. “We kept missing each other,” she said. “He had first asked me to play in ‘Funny Games’ and I had decided to not do it. The film is extraordinary, but I found that it didn’t leave any room for the imaginary actress that I was. To me, the film was like a scientific and clinical demonstration of how violence operates on the spectator and how the spectator is the plaything of this staging.” After Funny Games, Haneke proposed two other films that she wasn’t able to do. By the time he suggested The Piano Teacher, an ultimatum was given. “He told me, if you don’t want to do it, it’s over, I won’t propose you another film,” shared Huppert. “For that reason, I said ‘Yes, of course, I’ll do it! And then, I really read the script while I was in the plane! The next minute, I was landing at the Vienna airport (for the shoot).” Huppert would then go on to star for Haneke in Le Temps du Loup (2003), Amour (2012) and Happy End (2017). A happy end, indeed. “Do you think you can coax Haneke out of retirement?” asked Fremaux. “Not sure,” she replied. The perfect soldier on set? When asked whether she did what she was told on set, Huppert rather diplomatically, but with a twinkle in her eye, answered: “Yes, if the film goes according to plan.” “When you say ‘yes’ to a project, several stories start. I was lucky to meet directors who let me tell stories between me and myself.” When asked whether there’d been any conflicts on set, Huppert shared that she didn’t have any on a personal level, but that she had witnessed some – mentioning French film director Maurice Pialat. “Conflict can be a way of dialoguing and it can be interesting too. Making a film is hard, and making a dream concrete is not easy. Conflict is just a part of life.” She later added: “The whole history of cinema, painting, and literature is made of that – that’s why you make films, it’s both a big mystery and a blessing… There are people who like it and people who don’t. I don’t think we make movies to please everyone. And all the better. The hegemonic fantasy isn’t good – we all see where that can lead...” Self-deprecation and confessions Throughout the masterclass, Huppert was very candid and self-deprecating about the projects she’d starred in, many of which “I’m sure no one has seen!” One of the films she mentioned was her role in Otto Preminger’s 1975 thriller Rosebud. The film was originally set to star Robert Mitchum, who left the project due to disagreements with Preminger. Actually, it was due to Mitchum’s heavy drinking and the fact that Mitchum shared with Huppert: “I couldn’t give a fuck about cinema anymore.” This saddened Huppert, who shared the anecdote that Mitchum had played her an artist he’d been listening to at the time: Kris Kristofferson, who died earlier this year. Huppert would then go on to star alongside Kristofferson in Michael Cimino’s epic western Heaven’s Gate, which was infamously panned and gained further infamy as a film that not only generated financial damage for the studios due to its budget costs, but had a wider effect on the American film industry as a cautionary tale for studios to shift away from director-driven films. “At least I got to tell Kris Kristofferson that he was Robert Mitchum’s favourite singer on the set of 'Heaven’s Gate'!” On misogyny “Misogyny doesn’t just exist in cinema – it’s everywhere. I’ve learned to see it and recognise it. It has never gotten in the way of my acting.” Stairs not lifts Speaking about her career, Huppert said that she isn’t afraid of taking on roles that demand her to be away from home or get out of her comfort zone. When asked whether she was ever abroad on a shoot and in her hotel room at the end of the day, asking herself ‘What am I doing here?’, she retorted: “I love being in hotels – it really isn’t the worst part of my profession! As long as I can access my room via stairs and not the lift.” Indeed, Huppert confirmed that she has a phobia of lifts. “I’m scared of lifts, but not the unknown.” On her favourite books Huppert stated that she’s not a fan of revealing too much about her personal life, and that includes her favourite books or the ones that have shaped her. “Tell me what you read, I'll tell you who you are... Where’s the fun in that?” She did however reveal... Did you know? An audience member randomly asked Huppert what her favourite flowers were. “Roses.” Now you know. The Lumière Film Festival ends on 20 October."
Vanessa Paradis talks of her musical dreams and AI nightmares,"David Mouriquand
                                            & Fred Ponsard","16/10/2024,11:35 GMT+218/10/2024,16:56 GMT+2",Cinema,"Euronews Culture sits down with Vanessa Paradis, whose film career is celebrated at this year's Lumière Film Festival.","Alongside Isabelle Huppert and Benicio del Toro, the iconic Vanessa Paradis is one of the Lumiere Film Festival’s guests of honour for this 16th edition. The 51-year-old multidisciplinary artist has done it all. From shooting to international fame at the age of 14 with her single ‘Joe Le Taxi’, sustaining a successful musical career with critically acclaimed albums like 1988’s ‘M et J’, 2000’s ‘Bliss’ and the stunning ‘Divinidylle’ in 2007, to modelling and a filmography that has seen her collaborating with some of the greatest modern filmmakers like Jean-Claude Brisseau (Noce Blanche), Patrice Leconte (Une Chance Sur Deux, La Fille Sur Le Pont), Jean-Marc Vallée (Café de Flore), and Yann Gonzalez (Knife + Heart), there isn’t much the French star hasn’t done. Of course, she became known for a while in the world press as the wife of Johnny Depp, but her career trumps any tabloid gossip. She’s won countless prizes for her contributions to music and cinema, and the Lumière Film Festival is celebrating the latter with the screening this year of three of her most beloved films: the aforementioned La Fille Sur Le Pont (The Girl on the Bridge) and Café de Flore, as well as the hit romcom L’Arnacoeur (Heartbreaker) by Pascal Chaumeil. Euronews Culture sat down with Vanessa Paradis to chat about the festival, her desire to one day star in a musical, her fears regarding artificial intelligence, and what the next few years have in store for one of France’s most beloved performers. Euronews Culture: You're one of the guests of honour at this year’s edition of the Lumière Film Festival – how does it feel to have your on-screen career celebrated in the birthplace of cinema? Vanessa Paradis: It’s obviously very flattering and moving. Before I came to the festival, I knew there was going to be a masterclass I’d have to attend, and I was wondering whether I was going to have anything interesting to say! But it's a wonderful festival that celebrates cinema and the heritage of cinema. There are so many people - sublime cinephiles! I mean, I can be a cinephile, but I'm often missing references and half the information, and so it can be less exciting to talk about cinema. In this case, we happened to be talking about the films I've made and shot. And I didn't know that there was going to be a five-minute montage with lots of extracts from films I've been in. It made me dizzy, and very emotional. I was afraid I was going to answer questions with tears in my eyes... It was a lot! It’s true that it’s a festival that provokes a lot of emotions... Yes, because guests come to talk about their films and the films of others, but there's no competition at the Lumière Festival. There’s nothing at stake, so everyone's much more relaxed. It’s so rare in fact... How can I put it? In our lives, in our jobs, it's always one thing for another. We use each other. But here, it’s a celebration and more of a gift. It's something free. That’s an ugly way to describe it, but do you see what I mean? It's something natural. And then to go and see films - old films you wouldn’t get to see on the big screen... I think of parents who come with their children to see these films and that for me is very, very moving. It’s both intimate and quite grandiose... That’s exactly it. We had the opportunity to ask you prior to the opening ceremony what your “Rosebud film” was – the film that makes you love cinema and which you go back to the most. You told us that it was Singin’ In The Rain – which seems perfect for you, as both a singer and an actress. Which leads me to the question – when are we getting a musical? It's my dream to star in one! I've been offered musicals, but they're not completely musicals - they are musical from time to time. I did get the chance to be in the Poiraud brothers’ film Atomik Circus, in which I got to sing a few songs and dance a few numbers... But it wasn’t fully a musical. The musical I dream of starring in is the kind for which I have to train for a whole year – to learn how to dance numbers I don’t know, to sing incredible songs while telling a sumptuous story. That’s my dream! I can kick myself for not getting there after all these years of working. Maybe I haven’t provoked it enough or looked for it hard enough. But it’s never too late! I ended up rewatching your 1998 film Une Chance Sur Deux the other day, in which you star opposite two titans of French cinema, who are sadly no longer with us: Jean-Paul Belmondo and Alain Delon, who died a few months ago... I'm incredibly lucky to have been the one who was on that set, between Delon and Belmondo, and to have been filmed by Patrice Leconte. Who wouldn’t want to act with these two, who were reuniting on screen after all these years? And I got to be the young woman for whom these two potential fathers are fighting for. I can say that I was lucky enough to shoot with these two, and also to shoot with Jeanne Moreau, with Depardieu, Bruno Crémer, Daniel Auteuil... I’m forgetting to mention many others, but it’s crazy how lucky I’ve been and how emotional it makes me. Your taste for comedy stands out in your filmography, as well as a kind of anti-conformism in your choice of roles. It's a desire for adventure. A desire to experience things that you don't get to in real life. To play strong roles, to play colourful roles and to express yourself.  That's what's so exciting about playing strong, playing crazy, playing poetic. I’ve had the pleasure of working with people who have had a lot of humour and a lot of poetry. And, of course, a lot of love too. So, when I'm playing a difficult or gentle role, there's always that in my heart – because at the end of the day, we're all people who want to be loved and to love. To come back to the Lumière Festival, it feels like the ideal festival for cinephiles, with its restorations of older films, some of which you can see on screen for the first time in decades. This seems to clash with the rampant use of AI in both cinema and music, as artificial intelligence seems to be in contradiction to what this festival represents in terms of cultural heritage. What do you make of these technological advances? Are you intrigued or scared that it could represent the beginning of the end for creatives like yourself? Yes, it scares me. After that, however, I don't know. I don't know enough about artificial intelligence to know exactly what it can and can’t do, but I do know that for medicine, for example, it's something extraordinary and that it can save lives. In this case, I think it's fabulous. On the other hand, in art, I find the use of AI totally horrible. What's more, there are a lot of people who hijack our images, our lyrics, our songs, who fool the public...  I find this ugly. And it shows once again that human beings always go a bit too far with things that have the potential to be good. There’s always a moment when we go too far. As a species, we’re not particularly subtle... True. But I don't believe that AI can kill the creative profession. I mean, I don't want to believe it. Already, artificial intelligence can’t endanger live shows. We'll always have that. As for cinema... Well, look at this year’s Prix Lumière winner - Isabelle Huppert. Let’s see AI try to create a fake Isabelle Huppert! AI will never be able to do on screen what she is able to make us feel with her acting, with her powerful emotions. I can’t believe that an artificial intelligence could match her. You’re a shape-shifting and versatile artist. What does the future hold for you? Whether it’s music, cinema, and also theatre, after your Molière nomination with the play 'Maman'... What do the next few years look like? I can see the next few years going quite well, because I'm actually going to start shooting a film next week. It's Jérôme Commandeur's next film, with François Damiens and Laurent Lafitte. I can't wait to get started. And then I'm also in the process of preparing my new album, so when it's done, I'll have to release it and tour it... So the next few years are going to be pretty busy! And I almost forgot, there's also the Anne Le Ny film which I shot last year (Histoire d’un mariage) and will be released this coming February. So as you can see, very busy! And soon hopefully, that musical you’re dreaming of... Yes, hopefully... Fingers crossed! The Lumière Film Festival runs until 20 October."
Tech billionaires are on track to become the world's first trillionaires. Who will get there first?,Imane El Atillah,"13/10/2024,14:41 GMT+216/10/2024,14:46 GMT+2",Tech News,"The tech industry is home to eight of the world’s ten wealthiest individuals, but who among them will be the first to reach trillionaire status?","Meta CEO Mark Zuckerberg, one of the richest people in the world, has recently joined the exclusive group of those whose wealth has reached or exceeded $200 billion (€182.57 billion). Therefore, he becomes the newest member of this elite club, which includes only two other tech leaders - Amazon founder Jeff Bezos and Tesla CEO Elon Musk. Zuckerberg's wealth accumulation is largely attributed to his position as the largest shareholder of Meta, the parent company of social media networks Facebook, Instagram, and Threads, as well as the messaging platform WhatsApp. According to Bloomberg’s Billionaires Index, the three richest individuals in the world all come from the technology industry. Indeed, out of the top 10 wealthiest people, eight are from this sector. These include some notable names such as Larry Ellison, founder of Oracle, followed respectively by Microsoft co-founder Bill Gates and Larry Page, co-founder of Alphabet, Google’s holding company. The tech industry has also been one of the best-performing sectors, with six out of the seven companies to have reached trillion-dollar status coming from this field. According to a recent report by Informa Connect Academy, Microsoft, Apple, Nvidia, Alphabet, and Meta are all valued at over $1 trillion (€918 billion) as of July 2024. The same report also explored which of today’s multi-billionaires were most likely to reach trillionaire status, with predictions that the world could see its first trillionaire in as few as three years. The analysis was based on the net worth data of the 30 wealthiest people in the world, and calculations of their average annual growth rate over the last five years. The results were then used to create 30-year forecasts for each person's wealth to predict who is likely to become a trillionaire and estimate the year they would reach that status. Leading the list was Musk who could become the first trillionaire by 2027, with a net worth value ""growing at an average rate of 109.88 per cent every year"". The majority of Musk’s fortune is tied to his stakes in Tesla, the world's most valuable car manufacturer, and private rocket company SpaceX. He also owns about 79 per cent of X Corp, which he acquired in 2022 for $44 billion (about €39.6 billion), though its value has significantly fallen since then. Moreover, Musk also owns stakes in several startups including Neuralink, The Boring Company, and xAI. He could be followed by Gautam Adani, founder of the Adani Group, based in India, who is expected to reach the trillionaire status by 2028. That same year, Jensen Huang, one of the founders of the trillion-dollar company NVIDIA, is anticipated to become the next tech-industry trillionaire, with an annual growth rate in net worth of nearly 112 per cent. Out of all the 28 individuals predicted to become trillionaires within the next 30 years, 11 (about 40 per cent) were from the technology field alone. The list included other major names in the industry such as Zuckerberg and Bezos as well as Larry Page, Zhang Yiming, the founder of TikTok's parent company ByteDance, and Bill Gates, rounding out the list."
,,,,,
