header,author,publish_date,reading_time,category,text
AI-powered tech could help people with speech impairments to work remotely,"Nadia Leigh-Hewitson,CNN","4:26 AM EDT, Mon September 23, 2024",4 minute,"Business,Tech","You’ve probably experienced the frustration of being misheard or misunderstood by a smart speaker or AI assistant. For people with non-standard speech, it can happen in nearly every interaction with this kind of technology — Israeli company Voiceitt aims to change that. By using personalized voice models, its AI-powered speech recognition system helps people with speech impairments, caused by conditions like cerebral palsy, Parkinson’s, Down Syndrome or stroke, communicate more effectively with both people and digital devices. For Voiceitt co-founder Sara Smolley, facilitating speech recognition for non-standard speech patterns is a personal mission. “My grandmother was diagnosed with early-onset Parkinson’s disease,” she said. “By the time I was born, she had lost most of her motor capabilities, and her speech was impacted.” Voiceitt was launched as an app in 2021 and operated as a simple vocal translator, converting non-standard speech to audio. The AI is trained by the user recording themselves saying around 200 simple stock phrases. Smolley said the original idea was to facilitate in-person communication, but the technology has now also been tailored to remote workers. Voiceitt has developed integrations with WebEx and ChatGPT, along with a Google Chrome extension, which convert non-standard speech to captions shown on the screen. The company is also partnering with Zoom and Microsoft Teams. “One of the things that really stood out to me was the importance of accessibility technology in the workplace,” Smolley noted. “What a (wheelchair) ramp was to yesterday’s office building Voiceitt is to today’s remote workplace,” she said. The software is sold as either a per-minute or per-user license, with prices ranging from $20 to $50. Licenses can be bought in bulk for workplaces and health or education institutions. “People are using Voiceitt not just for video meetings, but for writing documents, emails, posting on LinkedIn and accessing web browsers by voice,” Smolley explained. “This has opened up the digital world for individuals who previously might not have been considered for certain jobs or able to communicate with colleagues or customers.” Among users of Voiceitt is Colin Hughes, a former BBC producer turned accessibility advocate. Living with muscular dystrophy, Hughes relies on dictation for his digital interactions, making him acutely aware of both the potential and limitations of current technologies. Hughes has used Voiceitt to compose emails and dictate longer written pieces. “I found Voiceitt’s app to be impressively accurate with my atypical speech, and its training and setup process was straightforward,” Hughes said, though he highlighted critical gaps for professional users. “Many people with impaired speech and upper-limb disabilities need more than just speech-to-text,” he noted. He advocates for features like voice-driven cursor control and improved dictation recognition for drafting long-form content, saying that Voiceitt works best for single-sentence messages. Hughes stresses a need for more comprehensive speech-recognition tech that lets users do things like manage emails and format documents using their voice. He sees a future where technology plays a bigger role in accessibility, adding: “This entire sector needs a shake-up. Voiceitt, with better access to major platforms, could be the one to lead this change.” According to Smolley, there has been significant progress in speech recognition technology in recent years. One example is the Speech Accessibility Project, a research project led by the University of Illinois’ Beckman Institute for Advanced Science and Technology, which is collecting voice data from people with different conditions to build algorithms for supporting people with non-standard speech. Earlier this year, Apple (AAPL) launched its AI-powered “Listen for Atypical Speech” feature, which uses machine learning to recognize a wider range of speech patterns. With technology that captures and stores personal data such as voice recordings, privacy can be a concern for users. Smolley says her company complies with European Union regulations, which she calls “the highest standards in the world in terms of data privacy.” “If the user’s data is being kept in our database with their consent, it’s anonymized and de-identified, and used to augment our data stack and improve our algorithm,” she adds. She believes Voiceitt’s technology can be life-changing. “We want to allow people not just to be more independent in their lives and work,” says Smolley, “but also to enjoy technology and have fun.”"
Grit and glamour: Behind-the-scenes docuseries asks what it takes to become a K-pop idol,"Lex Harvey,CNN","10:01 PM EDT, Thu August 29, 2024",5 minute,"Style,Arts","A new docuseries gives viewers an intimate look at the lives and struggles of K-pop stars, exploring the true cost of making it in South Korea’s cut-throat music industry. Apple TV+’s “K-Pop Idols” follows Jessi (Jessica Ho), a Korean American rapper forging a new path after leaving “Gangnam Style” artist Psy’s record label; girl group Blackswan, on the quest for global stardom but set back by interpersonal conflicts; and rookie Cravity, a nine-member boy band trying to make a name for itself after debuting during the Covid-19 pandemic. While Jessi has been on the Korean music scene since releasing her debut single in 2005, Cravity is a splashy newcomer trying to carve out its own style and space in a crowded market. Blackswan has existed for more than a decade with different members and names, but is trying to find its way in its current iteration, which evolves as the show develops. South Korean cultural exports have exploded over the past decade, with super-groups like BTS and Blackpink topping international music charts and K-drama series achieving mass popularity on streaming platforms. Following the performers as they embark on world tours, share emotional moments and undergo grueling hours-long training sessions, the new show offers insight into the highly competitive, multibillion dollar industry that holds its young stars to extremely high standards. K-pop idols, many of whom begin training as young teens, are often subjected to intense pressure from their strict management, a work culture that has been linked to a mental health crisis in the industry. Several K-pop stars have taken their own lives in recent years, prompting outpourings of grief from fans. One of the major storylines centers on the conflict between Blackswan members Leia (Larissa Ayumi Cartes Sakata) and Fatou (Fatou Samba), which begins when Leia posts on social media that she is bored during a social gathering at Fatou’s family home after the group’s first concert in Brussels. Leia later says she found the gathering hard because she missed her own family back home in Brazil, a struggle she discusses at length throughout the series. She also addresses her depression, and the stigma that comes with speaking openly about mental health. Related article
      ‘The only thing we can’t do is sign autographs’: The rise of virtual K-pop bands “I know I am sick,” the Brazilian singer said. “Here in Korea, depression is not a sickness.” In another vulnerable moment, an emotional Jessi speaks about the sacrifices that come with the job, particularly in terms of prioritizing work over relationships. “When I go back home (to) Korea, I go back to an empty house,” Jessi tells viewers. “It’s so lonely. I thought this was a pretty dream, but it wasn’t.” The series also documents the K-pop industry’s recent efforts to increase the genre’s global appeal by recruiting foreign talent. In June, South Korea’s finance ministry announced that the country would soon launch a new visa scheme, called the “K-Culture Training Visa,” for foreigners who want to train in K-pop dancing, choreography and modeling. Having started as a Korean-only band, Blackswan’s ever-evolving lineup is today exclusively made up of overseas-born members. Gabi and Sriya beat thousands of young women to become Blackswan “trainees,” in large part due to their nationalities according to Philip YJ Yoon, director of DR Music, the company that manages the group. Gabi’s home country, Brazil, is one of K-pop’s biggest markets outside South Korea. And India, where Sriya is from, is the world’s most populous country — and somewhere K-pop is starting to make inroads. The women undergo six months of backbreaking training in Korean language, rap, dance, and much else, testing not only their physical capabilities, but their mental resilience as well. Labels also face challenges when recruiting foreign K-pop stars, according to Yoon Deung-ryeong, DR Music’s founder and CEO – one of them being the looser reins expected by band members. Related article
      What it’s like to undergo 15 beauty treatments in just 3 days in South Korea “With other K-pop groups or girl groups, the company heavily controls the members. If the company says ‘don’t fight,’ they won’t fight,” he says in an early episode, referring to the conflict between Leia and Fatou. “But, with a multinational group, everyone’s language, culture and the way they express themselves is different. So, it doesn’t make sense to try to control them the way Korean groups are controlled.” Another topic in the show is the body image standards all K-pop idols must adhere to, and the extreme measures required to achieve it. The stars frequently speak about how little they eat and how much they train, even as their parents express concern. Gabi and Sriya are both placed on diets when they begin training – Gabi to lose weight, Sriya to gain it. Elsewhere, Cravity vocalist Wonjin says that when he first auditioned for his entertainment agency, Starship, he was instructed to lose weight, so he only ate one egg a day for two weeks, shedding 15 pounds. These tougher scenes are interspersed with moments of levity: the heartwarming friendship between Gabi and Sriya, a touching embrace between Fatou and her mother, the brotherhood between the Cravity members, the excitement of fans and the artists’ high-octane performances. Blackswan’s Fatou told CNN in an e-mail that filming the series was “freeing because we had an outlet for all of our bottled-up emotions.” “I felt like the camera was my therapist,” added Sriya. Related article
      ‘Oldboy’ director Park Chan-wook on the new age of K-cinema Blackswan’s members said they hoped the series would humanize K-pop artists in viewers’ eyes. “We are not perfect, and we go through just as many hardships as anyone else,” said group member NVee, also by email. “But we still persevere because of our love for music.” “K-Pop Idols” is available on Apple TV+ from August 30. CNN’s Jessie Yeung contributed reporting."
